{
  "output_version": "1.0.0",
  "input_sha256": "6c1ae4be9ed399aca36b114d42a53fd29b0e93ab3ebfcb1abfb4215b09813874",
  "rejected_records": [
    {
      "record_id": "arch.event_queue",
      "status": "CONDITIONAL",
      "rule_id": "R-API-003",
      "reason_code": "NOT_REQUIRED_BY_BRIEF"
    },
    {
      "record_id": "arch.multitenancy_isolation",
      "status": "CONDITIONAL",
      "rule_id": "R-API-002",
      "reason_code": "TENANCY_NOT_REQUIRED"
    }
  ],
  "feature_decisions": [
    {
      "decision_id": "feature.authentication",
      "status": "INAPPLICABLE",
      "rule_id": "R-API-AUTH-001",
      "reason_code": "PUBLIC_READ_ONLY_NO_AUTH_REQUIREMENT"
    },
    {
      "decision_id": "feature.authorization",
      "status": "INAPPLICABLE",
      "rule_id": "R-API-AUTH-001",
      "reason_code": "PUBLIC_READ_ONLY_NO_ROLE_AUTHORIZATION"
    },
    {
      "decision_id": "feature.billing",
      "status": "INAPPLICABLE",
      "rule_id": "R-EXCLUSION-001",
      "reason_code": "EXPLICITLY_OUT_OF_SCOPE"
    },
    {
      "decision_id": "feature.kubernetes",
      "status": "INAPPLICABLE",
      "rule_id": "R-EXCLUSION-001",
      "reason_code": "EXPLICITLY_OUT_OF_SCOPE"
    },
    {
      "decision_id": "feature.microservices",
      "status": "INAPPLICABLE",
      "rule_id": "R-EXCLUSION-001",
      "reason_code": "EXPLICITLY_OUT_OF_SCOPE"
    },
    {
      "decision_id": "feature.queue",
      "status": "INAPPLICABLE",
      "rule_id": "R-EXCLUSION-001",
      "reason_code": "EXPLICITLY_OUT_OF_SCOPE"
    }
  ],
  "authority_decisions": [],
  "unsupported_categories": [],
  "missing_or_unknown_facts": [],
  "unknown_fact_ids": [],
  "conflicting_fact_ids": [],
  "schema_errors": [],
  "unverified_evidence_facts": []
}
