{
  "output_version": "1.0.0",
  "input_sha256": "a56ff39fca5177e063addcfd90945c85195c031bf3e317ecc19f08ea31dcd1cc",
  "rejected_records": [
    {
      "record_id": "arch.event_queue",
      "status": "CONDITIONAL",
      "rule_id": "R-API-003",
      "reason_code": "NOT_REQUIRED_BY_BRIEF"
    }
  ],
  "feature_decisions": [
    {
      "decision_id": "feature.authentication",
      "status": "RECOMMENDED",
      "rule_id": "R-API-001",
      "reason_code": "EXPLICIT_AUTHENTICATED_USER_REQUIREMENT"
    },
    {
      "decision_id": "feature.authorization",
      "status": "RECOMMENDED",
      "rule_id": "R-API-001",
      "reason_code": "EXPLICIT_ROLE_AUTHORIZATION_REQUIREMENT"
    },
    {
      "decision_id": "feature.billing",
      "status": "INAPPLICABLE",
      "rule_id": "R-EXCLUSION-001",
      "reason_code": "EXPLICITLY_OUT_OF_SCOPE"
    },
    {
      "decision_id": "feature.kubernetes",
      "status": "INAPPLICABLE",
      "rule_id": "R-EXCLUSION-001",
      "reason_code": "EXPLICITLY_OUT_OF_SCOPE"
    },
    {
      "decision_id": "feature.microservices",
      "status": "INAPPLICABLE",
      "rule_id": "R-EXCLUSION-001",
      "reason_code": "EXPLICITLY_OUT_OF_SCOPE"
    },
    {
      "decision_id": "feature.multitenancy",
      "status": "CONDITIONAL",
      "rule_id": "R-API-002",
      "reason_code": "TENANT_ISOLATION_EVIDENCE_PENDING"
    },
    {
      "decision_id": "feature.queue",
      "status": "INAPPLICABLE",
      "rule_id": "R-EXCLUSION-001",
      "reason_code": "EXPLICITLY_OUT_OF_SCOPE"
    }
  ],
  "authority_decisions": [],
  "unsupported_categories": [],
  "missing_or_unknown_facts": [],
  "unknown_fact_ids": [],
  "conflicting_fact_ids": [],
  "schema_errors": [],
  "unverified_evidence_facts": []
}
