{
  "output_version": "1.0.0",
  "input_sha256": "030542ed2d7d1d32c5d907d92120b476526fdb4912602786a3979344b0bff240",
  "rejected_records": [],
  "feature_decisions": [
    {
      "decision_id": "feature.multi_agent_autonomy",
      "status": "INAPPLICABLE",
      "rule_id": "R-EXCLUSION-001",
      "reason_code": "EXPLICITLY_OUT_OF_SCOPE"
    },
    {
      "decision_id": "feature.production_deployment",
      "status": "INAPPLICABLE",
      "rule_id": "R-EXCLUSION-001",
      "reason_code": "EXPLICITLY_OUT_OF_SCOPE"
    },
    {
      "decision_id": "feature.vector_database",
      "status": "INAPPLICABLE",
      "rule_id": "R-EXCLUSION-001",
      "reason_code": "EXPLICITLY_OUT_OF_SCOPE"
    }
  ],
  "authority_decisions": [
    {
      "decision_id": "feature.high_impact_write",
      "status": "INCOMPLETE",
      "rule_id": "R-AUTHORITY-001",
      "reason_code": "ACCOUNTABLE_APPROVER_EVIDENCE_MISSING"
    }
  ],
  "unsupported_categories": [],
  "missing_or_unknown_facts": [],
  "unknown_fact_ids": [],
  "conflicting_fact_ids": [],
  "schema_errors": [],
  "unverified_evidence_facts": []
}
