{
  "output_version": "1.0.0",
  "input_sha256": "a75b5f717b24a4ad91f2c42da12c4c7a702bc8b18632d3f315d177510b2edd9f",
  "rejected_records": [],
  "feature_decisions": [
    {
      "decision_id": "feature.multi_agent_autonomy",
      "status": "INAPPLICABLE",
      "rule_id": "R-EXCLUSION-001",
      "reason_code": "EXPLICITLY_OUT_OF_SCOPE"
    },
    {
      "decision_id": "feature.production_deployment",
      "status": "INAPPLICABLE",
      "rule_id": "R-EXCLUSION-001",
      "reason_code": "EXPLICITLY_OUT_OF_SCOPE"
    },
    {
      "decision_id": "feature.vector_database",
      "status": "INAPPLICABLE",
      "rule_id": "R-EXCLUSION-001",
      "reason_code": "EXPLICITLY_OUT_OF_SCOPE"
    }
  ],
  "authority_decisions": [
    {
      "decision_id": "feature.high_impact_write",
      "status": "INAPPLICABLE",
      "rule_id": "R-AGENT-003",
      "reason_code": "NO_WRITE_CAPABILITY"
    }
  ],
  "unsupported_categories": [],
  "missing_or_unknown_facts": [],
  "unknown_fact_ids": [],
  "conflicting_fact_ids": [],
  "schema_errors": [],
  "unverified_evidence_facts": []
}
